{
  "assay": "ribogreen-ee",
  "variant": {
    "assay_type": "ribogreen-ee",
    "dye_dilution": "1:200",
    "triton_standard_curve": true,
    "curve_well_volume_uL": 100,
    "sample_well_volume_uL": 100,
    "incubation_time_min": 5,
    "incubation_temperature_C": 25,
    "ee_formula": "1-(free/total)",
    "excitation_nm": 485,
    "emission_nm": 530
  },
  "n_qc_results": 8,
  "n_signed_off": 8,
  "n_spec_miss": 2,
  "n_accepted_signoff": 7,
  "n_overridden_signoff": 1
}
